{
  "$schema": "https://json-schema.org/draft/2020-12/schema",
  "$id": "https://schemas.kumwe.org/studio/v1/studio-release.schema.json",
  "title": "Studio coordinated release record",
  "type": "object",
  "additionalProperties": false,
  "required": [
    "contractVersion",
    "kind",
    "release",
    "packages",
    "browserArtifacts",
    "protocolVersion",
    "corpusManifestDigest",
    "claimedProfiles"
  ],
  "properties": {
    "contractVersion": {
      "$ref": "common.schema.json#/$defs/contractVersion"
    },
    "kind": {
      "const": "studio-release"
    },
    "release": {
      "$ref": "common.schema.json#/$defs/semanticVersion"
    },
    "packages": {
      "type": "object",
      "additionalProperties": false,
      "required": [
        "@kumwe/studio-core",
        "@kumwe/studio-media",
        "@kumwe/studio-preview",
        "@kumwe/studio-protocol",
        "@kumwe/studio-renderer-web",
        "@kumwe/studio-rich-text",
        "@kumwe/studio",
        "@kumwe/studio-testkit"
      ],
      "properties": {
        "@kumwe/studio-core": {
          "$ref": "common.schema.json#/$defs/semanticVersion"
        },
        "@kumwe/studio-media": {
          "$ref": "common.schema.json#/$defs/semanticVersion"
        },
        "@kumwe/studio-preview": {
          "$ref": "common.schema.json#/$defs/semanticVersion"
        },
        "@kumwe/studio-protocol": {
          "$ref": "common.schema.json#/$defs/semanticVersion"
        },
        "@kumwe/studio-renderer-web": {
          "$ref": "common.schema.json#/$defs/semanticVersion"
        },
        "@kumwe/studio-rich-text": {
          "$ref": "common.schema.json#/$defs/semanticVersion"
        },
        "@kumwe/studio": {
          "$ref": "common.schema.json#/$defs/semanticVersion"
        },
        "@kumwe/studio-testkit": {
          "$ref": "common.schema.json#/$defs/semanticVersion"
        }
      }
    },
    "browserArtifacts": {
      "description": "Stable locators for the prebuilt browser delivery surfaces. Exact filenames, bytes, content hashes, SRI values and budgets are authoritative in the named asset manifest; approved release metadata pins the archive bytes without creating a release-record/archive digest cycle.",
      "type": "object",
      "additionalProperties": false,
      "required": ["manifest", "authoringArchive", "enhancementRuntime"],
      "properties": {
        "manifest": {
          "type": "object",
          "additionalProperties": false,
          "required": ["name", "schema"],
          "properties": {
            "name": { "const": "studio-assets.json" },
            "schema": {
              "const": "https://schemas.kumwe.org/studio/v1/studio-browser-assets.schema.json"
            }
          }
        },
        "authoringArchive": {
          "type": "object",
          "additionalProperties": false,
          "required": ["archiveStem", "assetRole", "loading"],
          "properties": {
            "archiveStem": {
              "type": "string",
              "pattern": "^studio-browser-(?:0|[1-9][0-9]*)\\.(?:0|[1-9][0-9]*)\\.(?:0|[1-9][0-9]*)(?:-(?:beta|rc)\\.(?:0|[1-9][0-9]*))?$"
            },
            "assetRole": { "const": "browser-module" },
            "loading": { "const": "module" }
          }
        },
        "enhancementRuntime": {
          "type": "object",
          "additionalProperties": false,
          "required": ["assetRole", "loading", "package", "packageBasePath"],
          "properties": {
            "assetRole": { "const": "enhancement-runtime" },
            "loading": { "const": "defer" },
            "package": { "const": "@kumwe/studio-renderer-web" },
            "packageBasePath": { "const": "dist/browser/" }
          }
        }
      }
    },
    "protocolVersion": {
      "$ref": "common.schema.json#/$defs/semanticVersion"
    },
    "corpusManifestDigest": {
      "$ref": "common.schema.json#/$defs/integrity"
    },
    "claimedProfiles": {
      "type": "array",
      "maxItems": 32,
      "uniqueItems": true,
      "items": {
        "$ref": "common.schema.json#/$defs/qualifiedName"
      }
    }
  }
}
