{
  "contractVersion": "0.1-draft",
  "kind": "studio-release",
  "release": "0.1.0-beta.10",
  "packages": {
    "@kumwe/studio-core": "0.1.0-beta.10",
    "@kumwe/studio-media": "0.1.0-beta.10",
    "@kumwe/studio-preview": "0.1.0-beta.10",
    "@kumwe/studio-protocol": "0.1.0-beta.10",
    "@kumwe/studio-renderer-web": "0.1.0-beta.10",
    "@kumwe/studio-rich-text": "0.1.0-beta.10",
    "@kumwe/studio": "0.1.0-beta.10",
    "@kumwe/studio-testkit": "0.1.0-beta.10"
  },
  "browserArtifacts": {
    "manifest": {
      "name": "studio-assets.json",
      "schema": "https://schemas.kumwe.org/studio/v1/studio-browser-assets.schema.json"
    },
    "authoringArchive": {
      "archiveStem": "studio-browser-0.1.0-beta.10",
      "assetRole": "browser-module",
      "loading": "module"
    },
    "enhancementRuntime": {
      "assetRole": "enhancement-runtime",
      "loading": "defer",
      "package": "@kumwe/studio-renderer-web",
      "packageBasePath": "dist/browser/"
    }
  },
  "protocolVersion": "0.1.0-draft.2",
  "corpusManifestDigest": "sha256-zCUp2e4c/e2l9YyBcfEs1MwW5amCfY2vffxcjbFgkio=",
  "claimedProfiles": []
}
